{
  "$schema": "https://json-schema.org/draft/2020-12/schema",
  "title": "OmniDistill-NAS benchmark suite",
  "type": "object",
  "required": ["schema_version", "name", "benchmarks"],
  "properties": {
    "schema_version": {"type": "integer", "minimum": 1},
    "name": {"type": "string"},
    "description": {"type": "string"},
    "benchmarks": {
      "type": "array",
      "items": {
        "type": "object",
        "required": ["id", "task", "backend"],
        "properties": {
          "id": {"type": "string"},
          "task": {"type": "string"},
          "backend": {"type": "string"},
          "config": {"type": "string"},
          "command": {"type": "array", "items": {"type": "string"}},
          "env": {"type": "object"},
          "tags": {"type": "array", "items": {"type": "string"}},
          "expected_metrics": {"type": "array", "items": {"type": "string"}}
        },
        "additionalProperties": true
      }
    }
  },
  "additionalProperties": true
}
